{
  "schemaVersion": 1,
  "productId": "siroino-tuxedo-halter-dress-large",
  "targetAvatar": "SiroinoSotai_PC",
  "sourceReference": "private-reference://sha256/66cd898014d3f503da8015207a0240d946aac72b596f28bef8d6574a0afb678b",
  "revisionId": "v1-reference-audited-pattern-first",
  "profilePath": "config/pipeline-profiles/garment-reconstruction-v1.json",
  "variables": {},
  "toolPins": {"draft-patterns": "pattern.garmentcode-2d"},
  "stageBindings": {
    "ingest-reference": {"command":["python","tools/run_ingest_reference_stage.py","--stage","ingest-reference","--job","config/products/siroino-tuxedo-halter-dress-large/job.json","--request","config/pipeline/requests/siroino-tuxedo-halter-dress-large.json","--result",".image2outfit/products/{productId}/stages/ingest-reference.json"],"resultPath":".image2outfit/products/{productId}/stages/ingest-reference.json"},
    "normalize-view": {"command":["python","tools/run_reference_product_stage.py","--stage","normalize-view","--job","config/products/siroino-tuxedo-halter-dress-large/job.json","--request","config/pipeline/requests/siroino-tuxedo-halter-dress-large.json","--result",".image2outfit/products/{productId}/stages/normalize-view.json"],"resultPath":".image2outfit/products/{productId}/stages/normalize-view.json"},
    "decompose-garment": {"command":["python","tools/run_reference_product_stage.py","--stage","decompose-garment","--job","config/products/siroino-tuxedo-halter-dress-large/job.json","--request","config/pipeline/requests/siroino-tuxedo-halter-dress-large.json","--result",".image2outfit/products/{productId}/stages/decompose-garment.json"],"resultPath":".image2outfit/products/{productId}/stages/decompose-garment.json"},
    "draft-patterns": {"command":["python","tools/run_reference_product_stage.py","--stage","draft-patterns","--job","config/products/siroino-tuxedo-halter-dress-large/job.json","--request","config/pipeline/requests/siroino-tuxedo-halter-dress-large.json","--result",".image2outfit/products/{productId}/stages/draft-patterns.json"],"resultPath":".image2outfit/products/{productId}/stages/draft-patterns.json"},
    "infer-stitches": {"command":["python","tools/run_reference_product_stage.py","--stage","infer-stitches","--job","config/products/siroino-tuxedo-halter-dress-large/job.json","--request","config/pipeline/requests/siroino-tuxedo-halter-dress-large.json","--result",".image2outfit/products/{productId}/stages/infer-stitches.json"],"resultPath":".image2outfit/products/{productId}/stages/infer-stitches.json"},
    "initialize-3d": {"command":["python","tools/run_reference_product_stage.py","--stage","initialize-3d","--job","config/products/siroino-tuxedo-halter-dress-large/job.json","--request","config/pipeline/requests/siroino-tuxedo-halter-dress-large.json","--result",".image2outfit/products/{productId}/stages/initialize-3d.json"],"resultPath":".image2outfit/products/{productId}/stages/initialize-3d.json"},
    "build-blender": {"command":["python","tools/run_reference_product_stage.py","--stage","build-blender","--job","config/products/siroino-tuxedo-halter-dress-large/job.json","--request","config/pipeline/requests/siroino-tuxedo-halter-dress-large.json","--result",".image2outfit/products/{productId}/stages/build-blender.json"],"resultPath":".image2outfit/products/{productId}/stages/build-blender.json"},
    "simulate-cloth": {"command":["python","tools/run_reference_product_stage.py","--stage","simulate-cloth","--job","config/products/siroino-tuxedo-halter-dress-large/job.json","--request","config/pipeline/requests/siroino-tuxedo-halter-dress-large.json","--result",".image2outfit/products/{productId}/stages/simulate-cloth.json"],"resultPath":".image2outfit/products/{productId}/stages/simulate-cloth.json"},
    "skin-and-export": {"command":["python","tools/run_reference_product_stage.py","--stage","skin-and-export","--job","config/products/siroino-tuxedo-halter-dress-large/job.json","--request","config/pipeline/requests/siroino-tuxedo-halter-dress-large.json","--result",".image2outfit/products/{productId}/stages/skin-and-export.json"],"resultPath":".image2outfit/products/{productId}/stages/skin-and-export.json"},
    "render-evidence": {"command":["python","tools/run_reference_product_stage.py","--stage","render-evidence","--job","config/products/siroino-tuxedo-halter-dress-large/job.json","--request","config/pipeline/requests/siroino-tuxedo-halter-dress-large.json","--result",".image2outfit/products/{productId}/stages/render-evidence.json"],"resultPath":".image2outfit/products/{productId}/stages/render-evidence.json"},
    "audit-geometry": {"command":["python","tools/run_reference_product_stage.py","--stage","audit-geometry","--job","config/products/siroino-tuxedo-halter-dress-large/job.json","--request","config/pipeline/requests/siroino-tuxedo-halter-dress-large.json","--result",".image2outfit/products/{productId}/stages/audit-geometry.json"],"resultPath":".image2outfit/products/{productId}/stages/audit-geometry.json"},
    "visual-review": {"command":["python","tools/run_reference_product_stage.py","--stage","visual-review","--job","config/products/siroino-tuxedo-halter-dress-large/job.json","--request","config/pipeline/requests/siroino-tuxedo-halter-dress-large.json","--result",".image2outfit/products/{productId}/stages/visual-review.json"],"resultPath":".image2outfit/products/{productId}/stages/visual-review.json"},
    "finalize-candidate": {"command":["python","tools/run_reference_product_stage.py","--stage","finalize-candidate","--job","config/products/siroino-tuxedo-halter-dress-large/job.json","--request","config/pipeline/requests/siroino-tuxedo-halter-dress-large.json","--result",".image2outfit/products/{productId}/stages/finalize-candidate.json"],"resultPath":".image2outfit/products/{productId}/stages/finalize-candidate.json"}
  }
}
